{
  "schemaVersion": 1,
  "name": "filesystem-project",
  "description": "Official MCP reference filesystem server restricted to the current project root.",
  "transport": "stdio",
  "command": "npx",
  "args": [
    "-y",
    "@modelcontextprotocol/server-filesystem@2026.7.10",
    "${PROJECT_DIR}"
  ],
  "requiredEnv": [],
  "risk": "high",
  "writeCapability": true,
  "defaultApprovalMode": "writes",
  "installable": true,
  "projectRequired": true,
  "source": {
    "type": "official-reference-server",
    "url": "https://github.com/modelcontextprotocol/servers/tree/main/src/filesystem"
  },
  "versionPolicy": "pinned-release-version"
}
